Search Date,ASIN,Name,Price,Rating,Review Amount,Amazon Prime,Sale,Brand,Image,URL
2023-07-20,B08KSCDM47,Neo Chair Office Computer Desk Chair Gaming-Ergonomic Mid Back Cushion Lumbar Support with Wheels Comfortable Blue Mesh Racing Seat Adjustable Swivel Rolling Home Executive (Black),44.98,4.0,"17,154",True,10K,,https://m.media-amazon.com/images/I/71EgGUGVrrL._AC_UL320_.jpg,https://www.amazon.com/CHAIR-Office-Chair-Computer-Gaming/dp/B08KSCDM47/ref=sr_1_1?keywords=chair&qid=1689874495&sr=8-1
2023-07-20,B01MSISJKG,Medline Shower Chair Seat with Padded Armrests and Back Heavy Duty Shower Chair for Bathtub Slip Resistant Shower Seat with Adjustable Height Shower Chair for Inside Shower with 350 lb Capacity,41.98,4.7,"25,808",True,10K,,https://m.media-amazon.com/images/I/6164i9BJ9hL._AC_UL320_.jpg,https://www.amazon.com/Medline-Shower-Armrests-Bathtubs-Supports/dp/B01MSISJKG/ref=sr_1_2?keywords=chair&qid=1689874495&sr=8-2
2023-07-20,B07B7K7N3P,"Furmax Office Chair Mid Back Swivel Lumbar Support Desk Chair, Computer Ergonomic Mesh Chair with Armrest (Black)",38.88,4.2,"58,252",False,10K,,https://m.media-amazon.com/images/I/71ohGSWApfL._AC_UL320_.jpg,https://www.amazon.com/Furmax-Support-Computer-Ergonomic-Armrest/dp/B07B7K7N3P/ref=sr_1_3?keywords=chair&qid=1689874495&sr=8-3
2023-07-20,B074YRN643,Amazon Basics Portable Folding Camping Chair with Carrying Bag,26.79,4.6,"13,581",True,10K,,https://m.media-amazon.com/images/I/91Pn9PITMzL._AC_UL320_.jpg,https://www.amazon.com/Amazon-Basics-Folding-Mesh-Back-Carrying/dp/B074YRN643/ref=sr_1_4?keywords=chair&qid=1689874495&sr=8-4
2023-07-20,B00PTL13LA,"Graco Slim Snacker High Chair, Ultra Compact High Chair, Whisk",79.97,4.8,"27,127",True,9K,,https://m.media-amazon.com/images/I/711jARycOrS._AC_UL320_.jpg,https://www.amazon.com/Graco-Snacker-Chair-Ultra-Compact/dp/B00PTL13LA/ref=sr_1_5?keywords=chair&qid=1689874495&sr=8-5
2023-07-20,B07SS4GMLW,"Yaheetech Office Chair Ergonomic Computer Chair Mid Back Adjustable Desk Chair with Lumbar Support Armrest, Swivel Mesh Task Gaming Chair for Home Office Work Study, Black",39.88,4.3,"11,359",False,4K,,https://m.media-amazon.com/images/I/816ErQxrg2L._AC_UL320_.jpg,https://www.amazon.com/Yaheetech-Ergonomic-Computer-Executive-Adjustable/dp/B07SS4GMLW/ref=sr_1_6?keywords=chair&qid=1689874495&sr=8-6
2023-07-20,B000ASB66O,Marcy Adjustable Hyper Extension Bench,86.99,4.4,"2,888",True,700,,https://m.media-amazon.com/images/I/61aVT3jtWsL._AC_UL320_.jpg,https://www.amazon.com/Marcy-Adjustable-Hyperextension-Exercise-JD-3-1/dp/B000ASB66O/ref=sr_1_7?keywords=chair&qid=1689874495&sr=8-7
2023-07-20,B08NV3K3Z4,"Sunny Health & Fitness Hyperextension Roman Chair with Dip Station - SF-BH620062 , Black",149.99,4.5,498,True,400,,https://m.media-amazon.com/images/I/81dCVjl0SAL._AC_UL320_.jpg,https://www.amazon.com/Sunny-Health-Fitness-Hyperextension-Station/dp/B08NV3K3Z4/ref=sr_1_8?keywords=chair&qid=1689874495&sr=8-8
2023-07-20,B000KHZ044,"Intex Floating Recliner Inflatable Lounge, 71in X 53in, Multicolor",26.41,4.4,"17,028",True,7K,,https://m.media-amazon.com/images/I/61jV-F6gFcL._AC_UL320_.jpg,https://www.amazon.com/Intex-Floating-Recliner-Inflatable-Lounge/dp/B000KHZ044/ref=sr_1_12?keywords=chair&qid=1689874495&sr=8-12
2023-07-20,B00P2XZKZ0,"GCI Outdoor Freestyle Rocker Portable Rocking Chair & Outdoor Camping Chair, Cinnamon",69.99,4.8,"19,449",True,10K,,https://m.media-amazon.com/images/I/81NQly+mCRL._AC_UL320_.jpg,https://www.amazon.com/GCI-Outdoor-Freestyle-Portable-Cinnamon/dp/B00P2XZKZ0/ref=sr_1_13?keywords=chair&qid=1689874495&sr=8-13
2023-07-20,B0BZCWY4CL,"Sweetcrispy Desk Chair, Armless Office Chair, Computer Chair, Small Home Office Chairs Low-Back Mesh Chair Task Chair Swivel Rolling Chair No Arms for Small Space with Lumbar Support",29.99,4.4,283,True,4K,,https://m.media-amazon.com/images/I/61Zgv93GRQL._AC_UL320_.jpg,https://www.amazon.com/Sweetcrispy-Armless-Computer-Low-Back-Rolling/dp/B0BZCWY4CL/ref=sr_1_14?keywords=chair&qid=1689874495&sr=8-14
2023-07-20,B081H3Y5NW,"Amazon Basics Classic Puresoft PU Padded Mid-Back Office Computer Desk Chair with Armrest, 26""D x 23.75""W x 42""H, Black",83.26,4.2,"30,974",True,8K,,https://m.media-amazon.com/images/I/71i08qnZeDL._AC_UL320_.jpg,https://www.amazon.com/AmazonBasics-Puresoft-PU-Padded-Mid-Back-Computer/dp/B081H3Y5NW/ref=sr_1_15?keywords=chair&qid=1689874495&sr=8-15
2023-07-20,B00FS3VJAO,"Home Office Chair Ergonomic Desk Chair Mesh Computer Chair with Lumbar Support Armrest Executive Rolling Swivel Adjustable Mid Back Task Chair for Women Adults, Black",38.88,4.3,"51,702",False,6K,,https://m.media-amazon.com/images/I/716tq9Y8WOL._AC_UL320_.jpg,https://www.amazon.com/Black-Office-Chair-Computer-Adjustable/dp/B00FS3VJAO/ref=sr_1_16?keywords=chair&qid=1689874495&sr=8-16
2023-07-20,B0147WIC7E,"BestOffice Executive Desk Chair for Office which is Ergonomically Made with Armrest & Lumbar Support, Mesh & Foam (Black)",39.99,4.2,"47,792",True,5K,,https://m.media-amazon.com/images/I/61v2Wcz3VpL._AC_UL320_.jpg,https://www.amazon.com/BestOffice-Executive-Ergonomically-Armrest-Support/dp/B0147WIC7E/ref=sr_1_17?keywords=chair&qid=1689874495&sr=8-17
2023-07-20,B08N6C7M5Q,"Summer Pop ‘N Sit Portable Booster Chair, Gray - Booster Seat for Indoor/Outdoor Use - Fast, Easy and Compact Fold",28.58,4.6,"21,628",True,7K,,https://m.media-amazon.com/images/I/819cBqsRbuL._AC_UL320_.jpg,https://www.amazon.com/Summer-Infant-Portable-Booster-Chair/dp/B08N6C7M5Q/ref=sr_1_18?keywords=chair&qid=1689874495&sr=8-18
2023-07-20,B01MRZ02TL,Homall Gaming Chair Office Chair High Back Computer Chair Leather Desk Chair Racing Executive Ergonomic Adjustable Swivel Task Chair with Headrest and Lumbar Support (White),99.99,4.4,"71,985",False,7K,,https://m.media-amazon.com/images/I/61HEqHMkRhL._AC_UL320_.jpg,https://www.amazon.com/Homall-Computer-Executive-Ergonomic-Adjustable/dp/B01MRZ02TL/ref=sr_1_19?keywords=chair&qid=1689874495&sr=8-19
2023-07-20,B00339C3P0,"Coleman Portable Camping Chair with 4-Can Cooler, Fully Cushioned Seat and Back with Side Pocket and Cup Holder, Carry Bag Included, Collapsible Chair for Camping, Tailgates, Beach, and Sports",39.97,4.7,"56,453",True,2K,,https://m.media-amazon.com/images/I/71lWvKI5TPL._AC_UL320_.jpg,https://www.amazon.com/Coleman-Portable-Camping-Chair-Cooler/dp/B00339C3P0/ref=sr_1_20?keywords=chair&qid=1689874495&sr=8-20
2023-07-20,B09XFLBGNX,"Tommy Bahama Backpack Beach Chair 2 Pack (Sailfish and Palms), Aluminum, Multicolor",110.70,4.7,"1,027",False,6K,,https://m.media-amazon.com/images/I/71UmegjPP0L._AC_UL320_.jpg,https://www.amazon.com/Tommy-Bahama-Backpack-Sailfish-Multicolor/dp/B09XFLBGNX/ref=sr_1_21?keywords=chair&qid=1689874495&sr=8-21
2023-07-20,B07YH2LB9R,"Tommy Bahama 5-Position Classic Lay Flat Folding Backpack Beach Chair, Polyester, Navy",60.75,4.4,"4,833",True,6K,,https://m.media-amazon.com/images/I/71uOwpRaZcL._AC_UL320_.jpg,https://www.amazon.com/Tommy-Bahama-5-Position-Classic-Backpack/dp/B07YH2LB9R/ref=sr_1_22?keywords=chair&qid=1689874495&sr=8-22
2023-07-20,B01KKHRNM0,"Baby Relax Hunter 3 Piece Kiddy Table and Chair Set, Gray",39.00,4.5,"12,407",True,3K,,https://m.media-amazon.com/images/I/81RSomQh4wL._AC_UL320_.jpg,https://www.amazon.com/Baby-Relax-Hunter-Piece-Kiddy/dp/B01KKHRNM0/ref=sr_1_23?keywords=chair&qid=1689874495&sr=8-23
2023-07-20,B00S57IQ6K,"Coleman Utopia Breeze Beach Chair, Lightweight & Folding Beach Chair with Cup Holder, Seatback Pocket, & Relaxed Design; 21-inch Seat Supports up to 250lbs",31.60,4.6,"5,593",True,1K,,https://m.media-amazon.com/images/I/71vL2heQYcL._AC_UL320_.jpg,https://www.amazon.com/Coleman-Utopia-Breeze-Beach-Sling/dp/B00S57IQ6K/ref=sr_1_24?keywords=chair&qid=1689874495&sr=8-24
2023-07-20,B0C7G1G5YB,"Office Chair Mid Back Desk Chair Ergonomic Mesh Computer Gaming Chair with Larger Seat, Executive Height Adjustable Swivel Task Chair with Lumbar Support Armrest for Women Adults",49.99,4.4,"1,150",True,6K,,https://m.media-amazon.com/images/I/71R-KGtX6JL._AC_UL320_.jpg,https://www.amazon.com/Ergonomic-Computer-Executive-Adjustable-Support/dp/B0C7G1G5YB/ref=sr_1_25?keywords=chair&qid=1689874495&sr=8-25
2023-07-20,B019C2COVO,"SwimWays Noodle Sling- Floating Pool Chair for Adults, Color May Vary.",8.70,3.4,"10,068",True,6K,,https://m.media-amazon.com/images/I/810eivysnbL._AC_UL320_.jpg,https://www.amazon.com/SwimWays-Noodle-Chair-Colors-Vary/dp/B019C2COVO/ref=sr_1_26?keywords=chair&qid=1689874495&sr=8-26
2023-07-20,B07MTQFTPW,"Dr. Kay’s Adjustable Bath Chair with Unique Heavy Duty Crossbar Supports, Shower Stool, Bathroom Chair, Safety Handicap Shower Chair for Inside Shower Seat, Shower Bench, 350 lb Capacity",39.49,4.8,"10,214",True,4K,,https://m.media-amazon.com/images/I/61Vx2+AQocL._AC_UL320_.jpg,https://www.amazon.com/Dr-Kays-Adjustable-Height-Shower/dp/B07MTQFTPW/ref=sr_1_27?keywords=chair&qid=1689874495&sr=8-27
2023-07-20,B07KJYY9BD,"BestOffice High-Back Gaming Chair PC Office Chair Computer Racing Chair PU Desk Task Chair Ergonomic Executive Swivel Rolling Chair with Lumbar Support for Back Pain Women, Men (White)",56.99,4.4,"19,458",False,5K,,https://m.media-amazon.com/images/I/61t4mpabO+L._AC_UL320_.jpg,https://www.amazon.com/BestOffice-Gaming-Executive-Headrest-Computer/dp/B07KJYY9BD/ref=sr_1_28?keywords=chair&qid=1689874495&sr=8-28
2023-07-20,B07GNDDNMW,SIHOO M18 Ergonomic Office Chair for Big and Tall People Adjustable Headrest with 2D Armrest Lumbar Support and PU Wheels Swivel Tilt Function Black,149.99,4.3,"12,187",True,2K,,https://m.media-amazon.com/images/I/61DJ4TR8FQL._AC_UL320_.jpg,https://www.amazon.com/SIHOO-Chair-Office/dp/B07GNDDNMW/ref=sr_1_29?keywords=chair&qid=1689874495&sr=8-29
2023-07-20,B09DLGM21Q,"Fisher-Price Portable Baby Chair Sit-Me-Up Floor Seat with 2 Developmental Toys, Rainbow Showers",41.49,4.8,"1,042",True,4K,,https://m.media-amazon.com/images/I/71NtOcVuv6L._AC_UL320_.jpg,https://www.amazon.com/Fisher-Price-Sit-Me-Up-Floor-Seat-Exclusive/dp/B09DLGM21Q/ref=sr_1_30?keywords=chair&qid=1689874495&sr=8-30
2023-07-20,B0BBPRZHRX,"GTPLAYER Gaming Chair, Computer Chair with Footrest and Lumbar Support, Height Adjustable Game Chair with 360°-Swivel Seat and Headrest and for Office or Gaming (White)",99.99,4.4,"7,232",False,5K,,https://m.media-amazon.com/images/I/61Y-czu8iaL._AC_UL320_.jpg,https://www.amazon.com/GTPLAYER-Computer-Footrest-Adjustable-360%C2%B0-Swivel/dp/B0BBPRZHRX/ref=sr_1_31?keywords=chair&qid=1689874495&sr=8-31
2023-07-20,B07C3ZRYVV,GCI Outdoor Waterside SunShade Backpack Beach Chair,60.79,4.5,"1,239",True,4K,,https://m.media-amazon.com/images/I/81eTx5ngPFL._AC_UL320_.jpg,https://www.amazon.com/GCI-Outdoor-Waterside-Reclining-Portable/dp/B07C3ZRYVV/ref=sr_1_32?keywords=chair&qid=1689874495&sr=8-32
2023-07-20,B00BPWDMOS,"Coleman Broadband Mesh Quad Camping Chair, Cooling Mesh Back with Cup Holder, Adjustable Arm Heights, & Carry Bag; Supports up to 250lbs",19.97,4.5,"7,891",False,10K,,https://m.media-amazon.com/images/I/71zoT4xLAEL._AC_UL320_.jpg,https://www.amazon.com/Coleman-Broadband-Mesh-Camping-Chair/dp/B00BPWDMOS/ref=sr_1_33?keywords=chair&qid=1689874495&sr=8-33
2023-07-20,B07V6MR1R5,CLIQ Portable Chair Camping Chairs - A Small Collapsible Portable Chair That Goes Every Where Outdoors. Compact Folding Chair for Adults - Camping Chair Supports 300 Lbs,99.99,4.3,"5,349",True,1K,,https://m.media-amazon.com/images/I/71XRcxQcpIL._AC_UL320_.jpg,https://www.amazon.com/sporting-goods-CLIQ-camping-chairs/dp/B07V6MR1R5/ref=sr_1_34?keywords=chair&qid=1689874495&sr=8-34
2023-07-20,B00IOGIM9S,"Inglesina Fast Table Chair - Award-Winning Baby High Chair for Eating & Dining - Compact, Portable & Foldable - Leaves No Scratches - for Babies 6-36 Months & 1-3 Year Old Toddler - Black",79.00,4.8,"6,894",True,4K,,https://m.media-amazon.com/images/I/71OZVL5FALL._AC_UL320_.jpg,https://www.amazon.com/Inglesina-Fast-Table-Chair-Award-Winning/dp/B00IOGIM9S/ref=sr_1_35?keywords=chair&qid=1689874495&sr=8-35
2023-07-20,B08KRCFPBB,"Baby Shark Chair Desk with Storage Bin - Ideal for Arts & Crafts, Snack Time, Homeschooling, Homework & More by Delta Children",29.97,4.7,"6,554",True,4K,,https://m.media-amazon.com/images/I/71rHoiiI1aL._AC_UL320_.jpg,https://www.amazon.com/Baby-Shark-Chair-Desk-Storage/dp/B08KRCFPBB/ref=sr_1_36?keywords=chair&qid=1689874495&sr=8-36
2023-07-20,B0B3J34F2Y,"Home Office Chair Ergonomic Desk Chair Mesh Computer Chair Modern Height Adjustable Swivel Chair with Lumbar Support/Flip-up Arms, Grey",53.86,4.5,"1,047",True,2K,,https://m.media-amazon.com/images/I/61d8tebWs8L._AC_UL320_.jpg,https://www.amazon.com/SMUG-Ergonomic-Computer-Adjustable-Support/dp/B0B3J34F2Y/ref=sr_1_37?keywords=chair&qid=1689874495&sr=8-37
2023-07-20,B0C1P9S7JB,"Office Chair, Desk Chair, Ergonomic Home Office Desk Chairs, Computer Chair with Flip up Armrests, Mesh Desk Chairs with Wheels, Office Desk Chair, Mid-Back Task Chair with Ergonomic Lumbar Support",59.99,4.5,213,True,2K,,https://m.media-amazon.com/images/I/71bG1vfdV-L._AC_UL320_.jpg,https://www.amazon.com/Ergonomic-Computer-Armrests-Mid-Back-Support/dp/B0C1P9S7JB/ref=sr_1_38?keywords=chair&qid=1689874495&sr=8-38
2023-07-20,B08KRCTMK4,"Delta Children Serta Perfect Extra Wide Convertible Sofa to Lounger, Comfy 2-in-1 Flip Open Couch/Sleeper for Kids, Grey",47.99,4.3,"8,327",True,4K,,https://m.media-amazon.com/images/I/81WWj-oL8vL._AC_UL320_.jpg,https://www.amazon.com/Serta-Perfect-Sleeper-Convertible-Lounger/dp/B08KRCTMK4/ref=sr_1_39?keywords=chair&qid=1689874495&sr=8-39
2023-07-20,B07Y8BXBX8,"GABRYLLY Ergonomic Mesh Office Chair, High Back Desk Chair - Adjustable Headrest with Flip-Up Arms, Tilt Function, Lumbar Support and PU Wheels, Swivel Computer Task Chair",215.60,4.5,"11,215",True,1K,,https://m.media-amazon.com/images/I/91Fa+MzIKEL._AC_UL320_.jpg,https://www.amazon.com/Gabrylly-Ergonomic-Mesh-Office-Chair/dp/B07Y8BXBX8/ref=sr_1_40?keywords=chair&qid=1689874495&sr=8-40
2023-07-20,B0BKG963VQ,NEO CHAIR Office Chair Computer Desk Chair Gaming - Ergonomic High Back Cushion Lumbar Support with Wheels Comfortable Black Leather Racing Seat Adjustable Swivel Rolling Home Executive,89.94,4.2,"9,296",True,3K,,https://m.media-amazon.com/images/I/61Tfivd45SL._AC_UL320_.jpg,https://www.amazon.com/neo-chair-Office-Computer-Gaming/dp/B0BKG963VQ/ref=sr_1_41?keywords=chair&qid=1689874495&sr=8-41
2023-07-20,B08531LKDG,"Health Line Massage Products Shower Stool 350lbs Bath Seat Chair, Tool-Free Assembly Height Adjustable Bath Bench with Padded Seat for Seniors, Elderly, Disabled, Handicap and Injured",39.99,4.5,"7,007",True,3K,,https://m.media-amazon.com/images/I/512dE4yuoiL._AC_UL320_.jpg,https://www.amazon.com/Upgraded-Tool-Free-Assembly-Adjustable-Disabled/dp/B08531LKDG/ref=sr_1_42?keywords=chair&qid=1689874495&sr=8-42
2023-07-20,B003399128,Coleman Portable Stadium Seat Cushion | Lightweight Padded Seat for Sporting Events and Outdoor Concerts | Bleacher Cushion with Backrest,16.99,4.0,"12,369",True,3K,,https://m.media-amazon.com/images/I/91oJ1FfjjzL._AC_UL320_.jpg,https://www.amazon.com/Coleman-2000020281-Stadium-Seat/dp/B003399128/ref=sr_1_43?keywords=chair&qid=1689874495&sr=8-43
2023-07-20,B004C0QDLO,"Kijaro Camping Chair, Dual Lock Feature, Arm Rest|Cushion Availability|Fol, Metal, Maldives Blue",36.49,4.7,"16,481",False,4K,,https://m.media-amazon.com/images/I/81lhDQbQdaL._AC_UL320_.jpg,https://www.amazon.com/Kijaro-Portable-Camping-Sports-Chair/dp/B004C0QDLO/ref=sr_1_44?keywords=chair&qid=1689874495&sr=8-44
2023-07-20,B07L6KM74G,"Amazon Basics Solid Wood Saddle-Seat Kitchen Counter-Height Stool, 24-Inch Height, Black - Set of 2",71.24,4.5,"25,489",True,6K,,https://m.media-amazon.com/images/I/711aqsVN1CL._AC_UL320_.jpg,https://www.amazon.com/AmazonBasics-Classic-Saddle-Seat-Kitchen-Counter/dp/B07L6KM74G/ref=sr_1_45?keywords=chair&qid=1689874495&sr=8-45
2023-07-20,B0B8MNF259,"PUKAMI Armless Office Desk Chair No Wheels,Fabric Padded Modern Swivel,Height Adjustable Wide Seat Computer Task Vanity Chair for Home Office,Mid Back Accent Chair (Beige)",89.99,4.5,806,False,3K,,https://m.media-amazon.com/images/I/812NGsUDw-L._AC_UL320_.jpg,https://www.amazon.com/PUKAMI-Armless-Office-Adjustable-Computer/dp/B0B8MNF259/ref=sr_1_46?keywords=chair&qid=1689874495&sr=8-46
2023-07-20,B07MGPLQF1,"Nice C Adults Low Beach Chair, Sling, Folding, Portable, Concert, Kids, Boat, Sand Chair with Cup Holder & Carry Bag (2 Pack of Blue)",75.99,4.4,"4,842",True,1K,,https://m.media-amazon.com/images/I/81mFyfo9fWL._AC_UL320_.jpg,https://www.amazon.com/Nice-Camping-Ultralight-Backpacking-Festival/dp/B07MGPLQF1/ref=sr_1_47?keywords=chair&qid=1689874495&sr=8-47
2023-07-20,B0B41X9SMT,Primy Drafting Chair Tall Office Chair with Flip-up Armrests Executive Ergonomic Computer Standing Desk Chair with Lumbar Support and Adjustable Footrest Ring (Black),108.99,4.4,760,True,1K,,https://m.media-amazon.com/images/I/71jZSluAFXL._AC_UL320_.jpg,https://www.amazon.com/Primy-Drafting-Executive-Ergonomic-Adjustable/dp/B0B41X9SMT/ref=sr_1_48?keywords=chair&qid=1689874495&sr=8-48
2023-07-20,B0C5DLNZQ2,"Genuine Leather Recliner Chair Sofa with Double Layer Backrest, Power Recliner, Retro Rivet Design, High-Density Sponge Recliner Chair for Living Room, Brown",699.99,4.0,1,False,50,,https://m.media-amazon.com/images/I/71FgFu9dXQL._AC_UL320_.jpg,https://www.amazon.com/sspa/click?ie=UTF8&spc=MTo1NzAwODc2NDg1OTI0OTIzOjE2ODk4NzQ0OTU6c3BfYnRmOjMwMDAxNTkxNzQ5MDYwMjo6MDo6&url=%2FBMBMT-Genuine-Recliner-Backrest-High-Density%2Fdp%2FB0C5DLNZQ2%2Fref%3Dsr_1_49_sspa%3Fkeywords%3Dchair%26qid%3D1689874495%26sr%3D8-49-spons%26sp_csd%3Dd2lkZ2V0TmFtZT1zcF9idGY%26psc%3D1
2023-07-20,B08D6HGS7T,"NOBLEWELL Office Chair Ergonomic Office Chair High Back Mesh Computer Chair with Lumbar Support Adjustable Armrest, Backrest and Headrest,Black",139.99,4.2,"4,756",True,1K,,https://m.media-amazon.com/images/I/71MzaFpWjwL._AC_UL320_.jpg,https://www.amazon.com/sspa/click?ie=UTF8&spc=MTo1NzAwODc2NDg1OTI0OTIzOjE2ODk4NzQ0OTU6c3BfYnRmOjIwMDA3NTI5NTQ4NTY5ODo6MDo6&url=%2FNOBLEWELL-Ergonomic-Computer-Adjustable-Backrest%2Fdp%2FB08D6HGS7T%2Fref%3Dsr_1_51_sspa%3Fkeywords%3Dchair%26qid%3D1689874495%26sr%3D8-51-spons%26sp_csd%3Dd2lkZ2V0TmFtZT1zcF9idGY%26psc%3D1
2023-07-20,B0C6LWSFXD,"Dripex Ergonomic Office Chair, High Back Desk Chair, Computer Mesh Chair with Lumbar Support, Adjustable Headrest & 2D Armrest, 90°-135°Tilt Function, 360° Swivel Home Office Task Chair, Black",119.99,4.5,45,False,1K,,https://m.media-amazon.com/images/I/71MwMl6tEwL._AC_UL320_.jpg,https://www.amazon.com/sspa/click?ie=UTF8&spc=MTo1NzAwODc2NDg1OTI0OTIzOjE2ODk4NzQ0OTU6c3BfYnRmOjIwMDE3NDg5MzAxMTU5ODo6MDo6&url=%2FDripex-Ergonomic-High-Back-Adjustable-Reclining%2Fdp%2FB0C6LWSFXD%2Fref%3Dsr_1_52_sspa%3Fkeywords%3Dchair%26qid%3D1689874495%26sr%3D8-52-spons%26sp_csd%3Dd2lkZ2V0TmFtZT1zcF9idGY%26psc%3D1
