Search Date,ASIN,Name,Price,Rating,Review Amount,Amazon Prime,Sale,Brand,Image,URL
2023-07-16,B07SS4GMLW,"Yaheetech Office Chair Ergonomic Computer Chair Mid Back Adjustable Desk Chair with Lumbar Support Armrest, Swivel Mesh Task Gaming Chair for Home Office Work Study, Black",19.88,4.3,"11,325",False,4K,,https://m.media-amazon.com/images/I/816ErQxrg2L._AC_UL320_.jpg,https://www.amazon.com/Yaheetech-Ergonomic-Computer-Executive-Adjustable/dp/B07SS4GMLW/ref=sr_1_31?keywords=chair&qid=1689531606&sr=8-31
2023-07-16,B00BPWDMOS,"Coleman Broadband Mesh Quad Camping Chair, Cooling Mesh Back with Cup Holder, Adjustable Arm Heights, & Carry Bag; Supports up to 250lbs",19.97,4.5,"7,861",False,10K,,https://m.media-amazon.com/images/I/71zoT4xLAEL._AC_UL320_.jpg,https://www.amazon.com/Coleman-Broadband-Mesh-Camping-Chair/dp/B00BPWDMOS/ref=sr_1_32?keywords=chair&qid=1689531606&sr=8-32
2023-07-16,B0BKG963VQ,NEO CHAIR Office Chair Computer Desk Chair Gaming - Ergonomic High Back Cushion Lumbar Support with Wheels Comfortable Black Leather Racing Seat Adjustable Swivel Rolling Home Executive,89.94,4.2,"9,271",True,3K,,https://m.media-amazon.com/images/I/61Tfivd45SL._AC_UL320_.jpg,https://www.amazon.com/neo-chair-Office-Computer-Gaming/dp/B0BKG963VQ/ref=sr_1_33?keywords=chair&qid=1689531606&sr=8-33
2023-07-16,B0B785WHZP,"Durable Hammock 400 lb Capacity - Lightweight Nylon Camping Hammock Chair - Double or Single Sizes w/Tree Straps and Attached Carry Bag - Portable for Travel/Backpacking/ (Navy, Medium)",14.99,4.7,503,True,4K,,https://m.media-amazon.com/images/I/81Ft0cJxAHL._AC_UL320_.jpg,https://www.amazon.com/Durable-Hammock-400-Capacity-Lightweight/dp/B0B785WHZP/ref=sr_1_34?keywords=chair&qid=1689531606&sr=8-34
2023-07-16,B07MGPLQF1,"Nice C Adults Low Beach Chair, Sling, Folding, Portable, Concert, Kids, Boat, Sand Chair with Cup Holder & Carry Bag (2 Pack of Blue)",82.99,4.4,"4,834",True,1K,,https://m.media-amazon.com/images/I/81mFyfo9fWL._AC_UL320_.jpg,https://www.amazon.com/Nice-Camping-Ultralight-Backpacking-Festival/dp/B07MGPLQF1/ref=sr_1_35?keywords=chair&qid=1689531606&sr=8-35
2023-07-16,B07Y8BXBX8,"GABRYLLY Ergonomic Mesh Office Chair, High Back Desk Chair - Adjustable Headrest with Flip-Up Arms, Tilt Function, Lumbar Support and PU Wheels, Swivel Computer Task Chair",269.50,4.5,"11,172",True,1K,,https://m.media-amazon.com/images/I/91Fa+MzIKEL._AC_UL320_.jpg,https://www.amazon.com/Gabrylly-Ergonomic-Mesh-Office-Chair/dp/B07Y8BXBX8/ref=sr_1_36?keywords=chair&qid=1689531606&sr=8-36
2023-07-16,B07C3ZRYVV,GCI Outdoor Waterside SunShade Backpack Beach Chair,60.79,4.5,"1,233",True,4K,,https://m.media-amazon.com/images/I/81eTx5ngPFL._AC_UL320_.jpg,https://www.amazon.com/GCI-Outdoor-Waterside-Reclining-Portable/dp/B07C3ZRYVV/ref=sr_1_37?keywords=chair&qid=1689531606&sr=8-37
2023-07-16,B0BLSCSRS5,Qulomvs Mesh Ergonomic Office Chair with Footrest Home Office Desk Chair with Headrest and Backrest 90-135 Adjustable Computer Executive Desk Chair with Wheels 360 Swivel Task Chair,185.99,4.3,505,False,3K,,https://m.media-amazon.com/images/I/71Qy7BcjlWL._AC_UL320_.jpg,https://www.amazon.com/Qulomvs-Ergonomic-Footrest-Adjustable-Executive/dp/B0BLSCSRS5/ref=sr_1_38?keywords=chair&qid=1689531606&sr=8-38
2023-07-16,B09GS5LVTJ,SPORT BEATS Stadium Seat for Bleachers with Back Support and Wide Padded Cushion Stadium Chair - Includes Shoulder Strap and Cup Holder,38.99,4.7,"4,286",True,4K,,https://m.media-amazon.com/images/I/81yTiU3YQaL._AC_UL320_.jpg,https://www.amazon.com/SPORT-BEATS-Bleachers-Cushion-Shoulder/dp/B09GS5LVTJ/ref=sr_1_39?keywords=chair&qid=1689531606&sr=8-39
2023-07-16,B07MTQFTPW,"Dr. Kay’s Adjustable Bath Chair with Unique Heavy Duty Crossbar Supports, Shower Stool, Bathroom Chair, Safety Handicap Shower Chair for Inside Shower Seat, Shower Bench, 350 lb Capacity",39.49,4.8,"10,188",True,4K,,https://m.media-amazon.com/images/I/61Vx2+AQocL._AC_UL320_.jpg,https://www.amazon.com/Dr-Kays-Adjustable-Height-Shower/dp/B07MTQFTPW/ref=sr_1_40?keywords=chair&qid=1689531606&sr=8-40
2023-07-16,B08R8TNDFT,"Delta Children Cozee Flip-Out 2-in-1 Convertible Sofa to Lounger for Kids, Pink Tie Dye",57.99,4.3,"2,842",False,3K,,https://m.media-amazon.com/images/I/611xP5RpsNL._AC_UL320_.jpg,https://www.amazon.com/Delta-Children-Cozee-Flip-Out-Sofa/dp/B08R8TNDFT/ref=sr_1_41?keywords=chair&qid=1689531606&sr=8-41
2023-07-16,B004C0QDLO,"Kijaro Camping Chair, Dual Lock Feature, Arm Rest|Cushion Availability|Fol, Metal, Maldives Blue",35.99,4.7,"4,784",False,4K,,https://m.media-amazon.com/images/I/81lhDQbQdaL._AC_UL320_.jpg,https://www.amazon.com/Kijaro-Portable-Camping-Sports-Chair/dp/B004C0QDLO/ref=sr_1_42?keywords=chair&qid=1689531606&sr=8-42
2023-07-16,B07FYVL48Z,Flash Furniture Whitney Mid-Back Desk Chair - White LeatherSoft Executive Swivel Office Chair with Gold Frame - Swivel Arm Chair,157.65,4.5,"5,079",True,400,,https://m.media-amazon.com/images/I/81K5GmJP-XL._AC_UL320_.jpg,https://www.amazon.com/Flash-Furniture-Mid-Back-Leather-Executive/dp/B07FYVL48Z/ref=sr_1_43?keywords=chair&qid=1689531606&sr=8-43
2023-07-16,B00KHR84WW,"Chicco Pocket Snack Booster Seat, Grey",39.99,4.5,"13,598",True,2K,,https://m.media-amazon.com/images/I/61tZGqebCfL._AC_UL320_.jpg,https://www.amazon.com/Chicco-Pocket-Snack-Booster-Seat/dp/B00KHR84WW/ref=sr_1_44?keywords=chair&qid=1689531606&sr=8-44
2023-07-16,B08KRCTMK4,"Delta Children Serta Perfect Extra Wide Convertible Sofa to Lounger, Comfy 2-in-1 Flip Open Couch/Sleeper for Kids, Grey",47.99,4.3,"8,301",True,4K,,https://m.media-amazon.com/images/I/81WWj-oL8vL._AC_UL320_.jpg,https://www.amazon.com/Serta-Perfect-Sleeper-Convertible-Lounger/dp/B08KRCTMK4/ref=sr_1_45?keywords=chair&qid=1689531606&sr=8-45
2023-07-16,B07YH3W49D,"Tommy Bahama 5-Position Classic Lay Flat Folding Backpack Beach Chair, Aluminum , Red, White, and Blue Stripe",71.69,4.5,"13,034",True,7K,,https://m.media-amazon.com/images/I/81KfcfatNbL._AC_UL320_.jpg,https://www.amazon.com/Tommy-Bahama-5-Position-Classic-Backpack/dp/B07YH3W49D/ref=sr_1_46?keywords=chair&qid=1689531606&sr=8-46
2023-07-16,B00IIFW2L4,"Amazon Basics Mesh, Mid-Back, Adjustable, Swivel Office Desk Chair with Armrests, Black",103.12,4.4,"16,032",True,4K,,https://m.media-amazon.com/images/I/91vH3ZqS2sL._AC_UL320_.jpg,https://www.amazon.com/AmazonBasics-Mid-Back-Office-Chair-Armrests/dp/B00IIFW2L4/ref=sr_1_47?keywords=chair&qid=1689531606&sr=8-47
2023-07-16,B07MD8HQL6,"ALPHA CAMP Oversized Camping Folding Chair, Heavy Duty Support 450 LBS Steel Frame Collapsible Padded Arm Chair with Cup Holder Quad Lumbar Back, Portable for Outdoor,Black",69.99,4.5,"6,437",False,3K,,https://m.media-amazon.com/images/I/71GugmK6cmL._AC_UL320_.jpg,https://www.amazon.com/ALPHA-CAMP-Oversized-Collapsible-Portable/dp/B07MD8HQL6/ref=sr_1_48?keywords=chair&qid=1689531606&sr=8-48
2023-07-16,B08D6HGS7T,"NOBLEWELL Office Chair Ergonomic Office Chair High Back Mesh Computer Chair with Lumbar Support Adjustable Armrest, Backrest and Headrest,Black",139.99,4.2,"4,746",True,1K,,https://m.media-amazon.com/images/I/71MzaFpWjwL._AC_UL320_.jpg,https://www.amazon.com/sspa/click?ie=UTF8&spc=MToyNTY3MzQ5NDY2NzM2NDQyOjE2ODk1MzE2MDY6c3BfYnRmOjIwMDA3NTI5NTQ4NTY5ODo6MDo6&url=%2FNOBLEWELL-Ergonomic-Computer-Adjustable-Backrest%2Fdp%2FB08D6HGS7T%2Fref%3Dsr_1_50_sspa%3Fkeywords%3Dchair%26qid%3D1689531606%26sr%3D8-50-spons%26sp_csd%3Dd2lkZ2V0TmFtZT1zcF9idGY%26psc%3D1
2023-07-16,B0BG1NBFFT,"FelixKing Ergonomic Office Chair, Headrest Desk Chair Office Chair with Adjustable Lumbar Support, Home Office Swivel Task Chair with High Back and Armrest, Adjustable Height Gaming Chair(Black)",179.99,4.4,385,True,300,,https://m.media-amazon.com/images/I/81UhmXlR+4L._AC_UL320_.jpg,https://www.amazon.com/sspa/click?ie=UTF8&spc=MToyNTY3MzQ5NDY2NzM2NDQyOjE2ODk1MzE2MDY6c3BfYnRmOjMwMDAxMDA5Mzk0ODkwMjo6MDo6&url=%2FFelixKing-Ergonomic-Headrest-Adjustable-Support%2Fdp%2FB0BG1NBFFT%2Fref%3Dsr_1_51_sspa%3Fkeywords%3Dchair%26qid%3D1689531606%26sr%3D8-51-spons%26sp_csd%3Dd2lkZ2V0TmFtZT1zcF9idGY%26psc%3D1
